{
  "project_meta": {
    "name": "GHOSTWIRE",
    "spec_source": "initial-ghostwire-task-description.md",
    "target": "local-docker-compose",
    "vector_db": "weaviate"
  },
  "contract_version": 1,
  "modules": [
    { "id": "shared_security", "owner": "knowledge-core-builder", "depends_on": [], "status": "done", "verify_status": "tier1_green", "worktree": "base", "last_commit": "9d41316da7eba1711bcaab4bf0dd19e65b46b462" },
    { "id": "knowledge_core", "owner": "knowledge-core-builder", "depends_on": ["shared_security"], "status": "done", "verify_status": "tier1_green", "worktree": "base", "last_commit": "9d41316da7eba1711bcaab4bf0dd19e65b46b462" },
    { "id": "chatbot", "owner": "chatbot-builder", "depends_on": ["knowledge_core", "shared_security"], "status": "done", "verify_status": "tier1_green", "worktree": "base", "last_commit": "6173064" },
    { "id": "feedback", "owner": "feedback-builder", "depends_on": ["knowledge_core", "shared_security"], "status": "done", "verify_status": "tier1_green", "worktree": "base", "last_commit": "6173064" },
    { "id": "team_assembler", "owner": "team-assembler-builder", "depends_on": ["knowledge_core", "shared_security", "feedback"], "status": "done", "verify_status": "tier1_green", "worktree": "base", "last_commit": "12a47d6" },
    { "id": "frontend", "owner": "frontend-builder", "depends_on": [], "status": "done", "verify_status": "tier1_green", "worktree": "base", "last_commit": "87e6543" }
  ],
  "requirements": [
    { "id": "REQ-001", "statement": "A shared Knowledge Core provides semantic_search and embedding over Weaviate (vector) + PostgreSQL (structured), and is the single brain all features depend on.", "type": "functional", "module": "knowledge_core", "priority": "mvp", "source_quote": "One brain, multiple interfaces. ... All features depend on it.", "acceptance_criteria_ids": ["AC-4"] },
    { "id": "REQ-002", "statement": "EmployeeIntelligenceProfile unifies CV data, skills, feedback summaries, and project history.", "type": "functional", "module": "knowledge_core", "priority": "mvp", "source_quote": "Unified model combining: CV data, Skills, Feedback summaries, Project history", "acceptance_criteria_ids": [] },
    { "id": "REQ-003", "statement": "Public RAG chatbot answers client and candidate queries using only retrieved context.", "type": "functional", "module": "chatbot", "priority": "mvp", "source_quote": "Public-facing AI agent (clients + candidates) ... Generate response via Claude", "acceptance_criteria_ids": ["AC-1", "AC-5"] },
    { "id": "REQ-004", "statement": "Chatbot response time is under 2 seconds.", "type": "nfr", "module": "chatbot", "priority": "mvp", "source_quote": "Response time < 2s", "acceptance_criteria_ids": [] },
    { "id": "REQ-005", "statement": "Chatbot never hallucinates: grounded answers only; abstain when grounding is insufficient.", "type": "constraint", "module": "chatbot", "priority": "mvp", "source_quote": "Grounded answers only (no hallucinations) ... Never hallucinate capabilities ... If unsure -> ask clarification", "acceptance_criteria_ids": ["AC-1"] },
    { "id": "REQ-006", "statement": "Chatbot detects intent (client vs candidate) and routes context retrieval accordingly.", "type": "functional", "module": "chatbot", "priority": "mvp", "source_quote": "Intent detection (client vs. candidate)", "acceptance_criteria_ids": [] },
    { "id": "REQ-007", "statement": "Feedback Intelligence Engine turns peer/manager/self reviews into structured strengths, weaknesses, risks (burnout/conflict), and team-dynamics signals, each with evidence.", "type": "functional", "module": "feedback", "priority": "mvp", "source_quote": "Analyze performance feedback and extract: strengths, weaknesses, behavioral signals, risks", "acceptance_criteria_ids": ["AC-2", "AC-5"] },
    { "id": "REQ-008", "statement": "AI Team Assembler analyzes a project then scores candidates and assembles a team (basic matching for MVP).", "type": "functional", "module": "team_assembler", "priority": "mvp", "source_quote": "Basic team matching (no optimization yet)", "acceptance_criteria_ids": ["AC-5"] },
    { "id": "REQ-009", "statement": "Team scoring uses behavioral/feedback signals derived from the Feedback Intelligence Engine.", "type": "functional", "module": "team_assembler", "priority": "mvp", "source_quote": "Team selection ignores behavioral data => fail; Data Used: Feedback intelligence", "acceptance_criteria_ids": ["AC-3"] },
    { "id": "REQ-010", "statement": "System is GDPR compliant; sensitive employee data stays in-VPC and is minimized in prompts/logs.", "type": "nfr", "module": "shared_security", "priority": "mvp", "source_quote": "GDPR compliant (critical)", "acceptance_criteria_ids": [] },
    { "id": "REQ-011", "statement": "Role-based access control at the API layer AND the retrieval layer (principal -> Weaviate tenant).", "type": "nfr", "module": "shared_security", "priority": "mvp", "source_quote": "Role-based access control", "acceptance_criteria_ids": [] },
    { "id": "REQ-012", "statement": "Append-only audit logs for every AI decision, keyed by trace_id.", "type": "nfr", "module": "shared_security", "priority": "mvp", "source_quote": "Audit logs for AI decisions", "acceptance_criteria_ids": [] },
    { "id": "REQ-013", "statement": "No external exposure of sensitive employee data; public chatbot runs on a PII-free tenant.", "type": "constraint", "module": "shared_security", "priority": "mvp", "source_quote": "No exposure of sensitive employee data externally", "acceptance_criteria_ids": [] },
    { "id": "REQ-014", "statement": "Explainability: every decision outputs why (citations / evidence_ref / rationale).", "type": "functional", "module": "shared_security", "priority": "mvp", "source_quote": "Every decision must output: Why this answer, Why this person/team", "acceptance_criteria_ids": ["AC-5"] },
    { "id": "REQ-015", "statement": "Frontend provides a public chat widget, an internal feedback dashboard, and an internal team-assembly UI.", "type": "functional", "module": "frontend", "priority": "mvp", "source_quote": "Public: Chat widget; Internal: Feedback dashboard; Internal: Team assembly UI", "acceptance_criteria_ids": ["AC-5"] },
    { "id": "REQ-016", "statement": "Team optimization (maximize skill coverage, collaboration probability, delivery success).", "type": "functional", "module": "team_assembler", "priority": "later", "source_quote": "Goal: Maximize skill coverage, collaboration probability, delivery success likelihood", "acceptance_criteria_ids": [] }
  ],
  "interface_contracts": {
    "openapi_path": "system/contracts/openapi.yaml",
    "shared_interfaces": [
      { "name": "KnowledgeCore.semantic_search", "stub_path": "system/contracts/stubs/shared_interfaces.py", "signature": "semantic_search(query: str, domain_filter: DomainFilter, auth_ctx: AuthContext, k: int = 5) -> list[RetrievedChunk]" },
      { "name": "EmbeddingService.embed", "stub_path": "system/contracts/stubs/shared_interfaces.py", "signature": "embed(texts: list[str]) -> list[Vector]  (EMBED_MODEL/EMBED_DIM pinned)" },
      { "name": "EmployeeIntelligenceProfile", "stub_path": "system/contracts/stubs/shared_interfaces.py", "signature": "dataclass(employee_id, name, cv_text, skills, feedback_summary, project_history, availability)" },
      { "name": "EmployeeRepository", "stub_path": "system/contracts/stubs/shared_interfaces.py", "signature": "get(employee_id, auth_ctx) -> EmployeeIntelligenceProfile | None ; list_candidates(auth_ctx, required_skills?) -> list[EmployeeIntelligenceProfile]" },
      { "name": "FeedbackIntelligence", "stub_path": "system/contracts/stubs/shared_interfaces.py", "signature": "analyze(reviews, auth_ctx) -> FeedbackAnalysis (PERSISTS by employee_id) ; get(employee_id, auth_ctx) -> FeedbackAnalysis | None" },
      { "name": "FeedbackAnalysis", "stub_path": "system/contracts/stubs/shared_interfaces.py", "signature": "dataclass(analysis_id, employee_id, feedback_score[0,1], sentiment[-1,1], strengths, weaknesses, risks, team_dynamics_signals, confidence_score)" },
      { "name": "AuthContext", "stub_path": "system/contracts/stubs/shared_interfaces.py", "signature": "dataclass(principal_id, role, org, allowed_tenants, allowed_domains)" },
      { "name": "build_auth_context", "stub_path": "system/contracts/stubs/shared_interfaces.py", "signature": "build_auth_context(bearer_token) -> AuthContext  (the ONLY token->AuthContext bridge)" },
      { "name": "PUBLIC_AUTH_CONTEXT", "stub_path": "system/contracts/stubs/shared_interfaces.py", "signature": "AuthContext(allowed_tenants={'public'}, allowed_domains=PUBLIC_DOMAINS) — /chat/query MUST use exactly this (REQ-013)" },
      { "name": "AuditRow", "stub_path": "system/contracts/stubs/shared_interfaces.py", "signature": "dataclass(trace_id, timestamp, principal_id, module, inputs_hash, retrieved_chunk_ids, prompt_version, model_version, output_ref, grounding_score, tenant)" },
      { "name": "AuditSink", "stub_path": "system/contracts/stubs/shared_interfaces.py", "signature": "append(row: AuditRow) -> None  (append-only; no update/delete grants)" },
      { "name": "accessors", "stub_path": "system/contracts/stubs/shared_interfaces.py", "signature": "get_knowledge_core() ; get_embedding_service() ; get_employee_repository() ; get_feedback_intelligence() ; get_audit_sink() — every module MUST call these (AC-4), not instantiate private impls" }
    ]
  },
  "output_schemas": {
    "rag_answer": "system/contracts/schemas/rag_answer.schema.json",
    "feedback_analysis": "system/contracts/schemas/feedback_analysis.schema.json",
    "team_assembly": "system/contracts/schemas/team_assembly.schema.json"
  },
  "acceptance_criteria": [